{
    "format_version": "1.0.0",
    "extensions": [
        "com.community.1.2.3"
    ],
    "tags": [
        "example",
        "demo",
        "funscript",
        "video"
    ],
    "title": "Example FSV Content",
    "creators": {
        "videos": [
            {
                "work_name": "Normal 2D Release",
                "source_url": "https://example.com/normal_video",
                "creator_info": {
                    "name": "John Doe",
                    "socials": [
                        "https://twitter.com/johndoe",
                        "https://patreon.com/johndoe"
                    ]
                }
            },
            {
                "work_name": "3D Stereoscopic Version",
                "source_url": "https://example.com/3d_video",
                "creator_info": {
                    "name": "Jane Smith",
                    "socials": [
                        "https://twitter.com/janesmith",
                        "https://patreon.com/janesmith"
                    ]
                }
            }
        ],
        "scripts": [
            {
                "work_name": "Normal Axis Script",
                "source_url": "https://example.com/normal_script",
                "creator_info": {
                    "name": "Alice",
                    "socials": [
                        "https://patreon.com/alice"
                    ]
                }
            },
            {
                "work_name": "Normal Roll Axis",
                "source_url": "https://example.com/normal_script",
                "creator_info": {
                    "name": "Alice",
                    "socials": [
                        "https://patreon.com/alice"
                    ]
                }
            },
            {
                "work_name": "Advanced Script Variant",
                "source_url": "https://example.com/advanced_script",
                "creator_info": {
                    "name": "Bob",
                    "socials": [
                        "https://twitter.com/bob"
                    ]
                }
            }
        ],
        "subtitles": [
            {
                "work_name": "English Subtitle Track",
                "source_url": "https://example.com/english_subtitles",
                "creator_info": {
                    "name": "Charlie",
                    "socials": [
                        "https://twitter.com/charlie"
                    ]
                }
            },
            {
                "work_name": "Spanish Subtitle Track",
                "source_url": "https://example.com/spanish_subtitles",
                "creator_info": {
                    "name": "Diana",
                    "socials": [
                        "https://twitter.com/diana"
                    ]
                }
            }
        ]
    },
    "video_formats": [
        {
            "name": "Normal.mp4",
            "description": "Standard 2D video",
            "duration": 123456,
            "checksum": "sha256:abcdef1234567890abcdef1234567890abcdef1234567890abcdef1234567890"
        },
        {
            "name": "3D.mp4",
            "description": "Stereoscopic 3D video",
            "duration": 123656,
            "checksum": "sha256:abcdef1234567890abcdef1234567890abcdef1234567890abcdef1234567890"
        }
    ],
    "script_variants": [
        {
            "name": "Normal.funscript",
            "description": "Standard script with optional roll axis",
            "additional_axes": [
                "roll"
            ],
            "duration": 123456,
            "start_offset": 0,
            "checksum": "sha256:1234567890abcdef1234567890abcdef1234567890abcdef1234567890abcdef"
        },
        {
            "name": "Advanced.funscript",
            "description": "Advanced script with pitch and yaw axes",
            "additional_axes": [
                "pitch",
                "yaw"
            ],
            "duration": 123456,
            "start_offset": 0,
            "checksum": "sha256:1234567890abcdef1234567890abcdef1234567890abcdef1234567890abcdef"
        }
    ],
    "subtitle_tracks": [
        {
            "name": "English.srt",
            "language": "en",
            "description": "English subtitles",
            "checksum": "sha256:fedcba0987654321fedcba0987654321fedcba0987654321fedcba0987654321"
        },
        {
            "name": "Spanish.smi",
            "language": "es",
            "description": "Spanish subtitles",
            "checksum": "sha256:fedcba0987654321fedcba0987654321fedcba0987654321fedcba0987654321"
        }
    ]
}